{
  "minPrice": {
    "default": 10,
    "PISTACHIO-500G": 4.5
  },
  "acceptedPaymentTerms": ["advance_payment", "lc", "credit_30"],
  "productionCapacity": {
    "PISTACHIO-500G": { "unit": "carton", "maxPerMonth": 5000 }
  },
  "sensitiveCountries": ["RU", "SY"],
  "sensitiveCustomers": [],
  "paymentGuidance": {
    "largeDealThreshold": 50000,
    "highRiskMethods": ["lc", "advance_payment"],
    "mediumRiskMethods": ["lc", "advance_payment"],
    "lowRiskMethods": ["credit_30", "lc", "advance_payment"]
  },
  "requiredApprovals": ["below_min_price", "non_standard_payment_terms", "sensitive_party", "send_message", "send_proforma"]
}
